{
  "schema_version": "cognitive-os-distribution-manifest-v1.5",
  "target": "gemini",
  "source_commit": "UNRELEASED_WORKTREE",
  "package_version": "1.5.0-dev",
  "included_assets": ["skills/cognitive-os", "gemini-extension.json"],
  "projected_assets": ["SKILL.md", "references/", "policies/", "schemas/", "VERSION", "gemini-extension.json"],
  "omitted_assets": ["bootstrap/", "telemetry/", "tools/", "evals/", "adapters/"],
  "feature_availability": {
    "cognitive_core": "COMPLETE",
    "local_capability_discovery": "PARTIAL",
    "external_capability_discovery": "UNAVAILABLE",
    "grounded_corpus": "PARTIAL",
    "machine_contract_documents": "COMPLETE",
    "machine_contract_runtime_validator": "UNAVAILABLE",
    "flight_recorder": "UNAVAILABLE",
    "telemetry_sharing": "UNAVAILABLE",
    "forensic_bundle_runtime": "UNAVAILABLE"
  },
  "schema_enforcement": "PARTIAL",
  "notes": "The extension is a thin wrapper around the canonical Agent Skill; no duplicate prompt context or MCP server is bundled."
}
