{
  "schema_version": "cognitive-os-distribution-manifest-v1.5",
  "target": "openai",
  "source_commit": "UNRELEASED_WORKTREE",
  "package_version": "1.5.0-dev",
  "included_assets": ["skills/cognitive-os"],
  "projected_assets": ["SKILL.md", "references/", "policies/", "schemas/", "VERSION"],
  "omitted_assets": ["bootstrap/", "telemetry/", "tools/", "evals/", "adapters/"],
  "feature_availability": {
    "cognitive_core": "COMPLETE",
    "local_capability_discovery": "PARTIAL",
    "external_capability_discovery": "UNAVAILABLE",
    "grounded_corpus": "PARTIAL",
    "machine_contract_documents": "COMPLETE",
    "machine_contract_runtime_validator": "UNAVAILABLE",
    "flight_recorder": "UNAVAILABLE",
    "telemetry_sharing": "UNAVAILABLE",
    "forensic_bundle_runtime": "UNAVAILABLE"
  },
  "schema_enforcement": "PARTIAL",
  "notes": "Availability depends on the actual Work/Codex surface and workspace policy. This repository does not claim a Plugin Directory submission."
}
